<?xml version="1.0"?>
<CatalogoPeliculas xmlns:xs="http://www.w3.org/2001/XMLSchema-instance" xs:noNamespaceSchemaLocation="ejercicio2.xsd">

    <Pelicula>
        <Titulo>The Matrix</Titulo>
        <Duracion>136</Duracion>
        <Genero>Sci-Fi and Fantasy</Genero>
        <Actores>
            <Actor>Keanu Reeves</Actor>
            <Actor>Laurence Fishburne</Actor>
            <Actriz>Carrie Ann Moss</Actriz>
        </Actores>
        <Fecha>1999</Fecha>
        <Director>Wachowski Brothers</Director>
        <Formato>MP4</Formato>
    </Pelicula>

    <Pelicula>
        <Titulo>Titanic</Titulo>
        <Duracion>194</Duracion>
        <Genero>Drama</Genero>
        <Actores>
            <Actor>Leonardo DiCaprio</Actor>
            <Actriz>Kate Winslet</Actriz>
        </Actores>
        <Fecha>1999</Fecha>
        <Director>James Cameron</Director>
        <Formato>AVI</Formato>
    </Pelicula>

    <Pelicula>
        <Titulo>The Sixth Sense</Titulo>
        <Duracion>106</Duracion>
        <Genero>Thriller</Genero>
        <Actores>
            <Actor>Bruce Willis</Actor>
            <Actor>Haley Joel Osment</Actor>
        </Actores>
        <Fecha>1999</Fecha>
        <Director>M. Night Shyamalan</Director>
        <Formato>MP4</Formato>
    </Pelicula>

</CatalogoPeliculas>